Blog_ID,Author,Author_ID,Title,Publication_Date,Blog Text
leWFvK2g6H,Mason Taylor,NzUPqAdL1s,Mysterious Adventure in the Future,1905-11-10,@crucius89 miiiiiiiiiiiiiiira la rotita tenia #twitter aunque esta novata aun
Im4s2OecD0,Liam Clark,Jn2DCD1U1Q,Magical Journey Beyond the Stars,1936-02-06,GMusic Unites #Google #Music with #Apple iOS [#Apps] http://t.co/R0ih6ePa #republished
mcIUFChqkm,Ava Lopez,KT55qADzcH,Amazing Life Beyond the Stars,1917-06-17,I did the best of everyone who failed - Bill Gate #Microsoft
4GYZMi6gxF,Ethan Anderson,EOH85NFBrQ,Mysterious Journey Beyond the Stars,1956-02-03,"Cream on the inside, clean on the outside. Ice Cream phone job. #Google"
AAQNhEXUKP,Carol Williams,OghnGx6nW8,Magical Life in the Mountains,2005-06-22,Hasta Mañana Que Descansen #Twitter Off !!
VcrKB3MTXA,Charlotte Garcia,aJmWQn1yhZ,Magical Adventure Under the Sea,1940-04-15,¿Quién dijo crisis? @Apple ha vendido 4 millones de unidades del #iPhone4S en sólo tres días
2xyYXrq7on,Matthew Davis,OjcL2ROOwO,Incredible Secret Under the Sea,2022-06-16,@SERGIOapple incluso si usas #Google #Chrome hay una App. Y al igual es mas practica pero es para el navegador
ZrLaQfK2Xq,Mason Lopez,OS4gUHTBya,Amazing Story of the Ancient World,1906-07-16,#Microsoft's Kinect brings 'playful learning' to the Xbox 360 http://t.co/1KAi853k
CichBEDATU,Alice Martinez,YQ7XOeq8M9,Mysterious Life in the Mountains,1980-10-21,How #Apple eclipsed #Microsoft http://t.co/1fH0dFGj from @guardian
c81pllna86,Isabella Lopez,zHQJByk9oc,Fantastic Story Beyond the Stars,2009-12-16,RT @BucBoyy: - It's So Funny Because She Got A #Twitter Now Lol.
CSTs6Z31Ei,Ivy Thompson,yjmmxRf5dc,Incredible Life Beyond the Stars,1987-08-09,#twitter why must you be so difficult?
UTqNn0Xbcl,Bob Lee,7oIxUiJxMk,Mysterious Adventure in the Mountains,1956-02-20,@Apple: Siri is amazing!!! I'm in love!
rOXAuIV3xc,Logan Clark,UGYOWnsBBP,Amazing Adventure in the Future,1995-06-22,uuchas... #twitter menso! dormish bye! xD
skCbMEifN0,Jack Lee,GsL2Q2GumY,Incredible Adventure in the Future,1964-05-17,RT @kenbellezen: Vers 1e +grde accessibilité o dernier outil #IT. C la new orientation stratégique ke prend #Microsoft #Maroc http://t.c ...
jTtBgZtOaY,Charlotte Rodriguez,ARxv59GWX6,Amazing Adventure Under the Sea,2014-05-22,An apple update has seemed to render my work machine incapable of opening HDV video. Thanks @Apple. Zero useful productivity today.
JR6qxCNGnm,Evelyn Lopez,zCi1tSCQCi,Mysterious Secret Under the Sea,1983-12-04,"Rumor: New screen sizes, specs coming to Windows Phones #windowsphone #microsoft: A rumor has surfaced that sugg... http://t.co/wHDrAQO4"
RNtbyfsxe9,Isabella Walker,ELyN3umRco,Magical Journey in the Future,2018-10-01,#twitter is not #eharmony
ZIvxFUEq3c,Isabella Clark,sHV59yIsiN,Fantastic Journey Under the Sea,1969-10-11,one more picture of the services provided in the #cloud. I am in love with #Microsoft http://t.co/Q0QLeokZ
b2gjVWJi2b,Grace Brown,J3CMDSD4WV,Magical Adventure of the Ancient World,1986-07-28,"#Google thinks your digital books belong on a digital #bookcase, digitally (video) http://t.co/Qtt22akr"
jmj49B8Mjb,Daniel Johnson,C9ScShmOaE,Fantastic Life in the Mountains,1991-03-15,"to saindo aqui pessoal do #twitter, bjbj e abraços."
V2hvFEuLB9,Jack Jones,M6gtb455ex,Mysterious Adventure Under the Sea,1933-09-09,@zombiebomber have been on the phone with @verizonwireless and @apple pretty much ever since then. Really annoyed.
miHMKOaeFe,Grace Hall,RxrKO4V4PR,Amazing Secret of the Ancient World,1975-03-13,Microsoft Stores giving away free Windows Phone devices with $499 spend http://t.co/YEVwfL4N #microsoft #windows
TshioDTADH,Bob Lewis,hPd7Ikingb,Amazing Journey of the Ancient World,1950-03-17,"RT @zvitaly: Антивирус #Microsoft Security Essentials удаляет из системы браузер #Google #Chrome, считая его трояном PWS Win32/Zbot: htt ..."
F1hXTldJ7g,Ava Thomas,KkNWFa4ol7,Amazing Adventure of the Ancient World,1931-09-01,"Ok, so it was a lion and not a leopard. Too much upgrading this weekend. @apple"
2kmWhyKkJ8,Aiden Johnson,gSklGHlLKJ,Amazing Adventure Beyond the Stars,2023-02-04,Très plaisante cette mise à jour d'Android ! En espérant que cela stimulera Apple à nous pondre du nouveau. #Google #icecreamsandwich
1yUBfbLRDp,Mason Wilson,I6VAHZqfiA,Magical Story Under the Sea,1976-03-31,"#facebook, #Twitter , #spongebob, #nirvana. Great way to spend the night. :D"
L6l5Cb59CX,Mason White,5V3wejH1jl,Incredible Secret of the Ancient World,1926-03-12,RT @Simon_Townsend: #Microsoft tests and proves #AppSense enterprise scalability! 78K users on one personalization DB - http://t.co/LwFLXASL
ue2HRXmmg6,Ethan Gonzalez,RUp9C5oVY7,Mysterious Journey Beyond the Stars,1917-09-10,Ufff... after #Microsoft #MTS11 and #MVP meeting. Was great! #MVPBuzz
jNHSIw5eMw,Ethan Rodriguez,Dny5H6KmdX,Fantastic Journey Beyond the Stars,1989-12-12,"Yu cant answer , But yu can b on #Fb Nd #Twitter"
0H3bKIaGhP,Olivia Smith,UElyVdpAYF,Fantastic Life Under the Sea,1958-10-25,#Occupy #Twitter...Let&#39;s make Twitter a Social Media not a just a Bulletin Board. Engage! Interact! Socialize!
kurEgbsOh5,David Martin,DVPpEBx0F1,Magical Adventure Under the Sea,1906-07-12,I want Siri on my iPhone4 ! @apple
d90hZf3CwL,Aiden Martin,R3E1vrXGp4,Magical Story in the Future,1968-04-23,#SMAU Milano & #I9 domani un posto in prima fila!Vi aspetto 11:30 area sessioni tecniche #Microsoft stay tunef!
ctWPApZVnA,David Miller,qPRKrVu6ZV,Magical Story of the Ancient World,1945-05-24,dear #google & #samsung... learn some presentation 101 first. please.
7Q4CAeO2N3,Mia Robinson,rSk1T6rolV,Fantastic Life in the Mountains,1978-05-25,Bummer!  My @Yahoo! iPad fantasy football app keeps crashing; not sure if it's the app or the new @apple iOS 5. Only two apps running.
ibChS4FscZ,Jacob Moore,LaMfdJH2Oz,Incredible Story Under the Sea,1995-01-16,"Bij #Microsoft zijn ze echt niet goed snik, ik was blij dat mijn mobiel gejat werd omdat er windows op zat..  #jaloezie http://t.co/fd0THHCv"
UXMZI0YKdN,Bob Davis,RoicwaQa8Y,Fantastic Journey in the Future,2010-01-08,The more i use Office 2010 the more i fall in love it with. #honest #genius #microsoft
DPAHC1XrZ0,Frank Moore,xFkfSkteT9,Fantastic Journey Under the Sea,1958-11-27,Geek Fact for October 19th - 1998: U.S. Department of Justice antitrust case against #Microsoft began. #geekfact
a8bqIXpezq,Charlotte Smith,anUfiCTcet,Incredible Life of the Ancient World,1928-04-07,"Google помнит о тебе, нищеброд. http://t.co/LtWQVySF  #События #4.0 #Android #Google"
kAXuZkosJr,Daniel Anderson,7pNPzvwkul,Incredible Journey Beyond the Stars,1915-01-01,This twitter shit is funny and entertaining ... I haven't did shit all day but my fingers are hurting #twitter
vtyFcaIlmc,Charlotte Gonzalez,lpBAMcWly8,Amazing Life in the Mountains,1934-06-20,A New Landscape for Retail Banking: New report from #Efma with #Microsoft http://t.co/2XNz3F9C
fmufNWr8kq,Alice Martinez,CpyBWJHXf5,Incredible Life in the Mountains,1940-08-28,продвижение статьями http://t.co/zZ8PjWwX Cервис регистрации в каталогах статей #seo #linkbuilding #backlinks #addurl #bookmarks #google
qce4n8nhJF,Matthew Martin,JEuTN6s2O8,Mysterious Story Under the Sea,1957-09-02,Google+ to Support Pseudonyms http://t.co/ms1eBXpx #google+ #googlesocialmedia #googleventures #facebook #twitter #socialmediamarketing
9AThmEioBK,Logan Martin,rHTJpqI2F4,Amazing Secret in the Future,1926-05-20,MS社の「そろそろXPやめて」にネット住民「は？」 http://t.co/YGmidiiw #Microsoft #WindowsXP
3X7LNUCk4t,Jacob Lewis,Jto4QTFt7X,Amazing Story Under the Sea,1908-06-15,RT @asherCFO: #Yahoo up 4 sale - again! Yrs back #Microsoft almost bought it & now glad it didn't. This could b deal of the year that do ...
fkN2kYHbu8,Daniel Rodriguez,06eSvLkh1K,Magical Secret of the Ancient World,2012-02-04,What’s new in the #Microsoft world after #bldwin? Find out at #DevReach in Europe. Register at
dezyq8AK6z,David Martinez,Hq7JQIkJyl,Amazing Life Under the Sea,1981-04-28,"""#Win an @Apple iPod Touch from @Mommy_gaga, get the @Pampers Hello World Baby Memories App! http://t.co/eYLm3pav #PampersHelloApps"""
lSNEFU0s9E,Sophia Lopez,HLrZsVxb52,Incredible Secret Beyond the Stars,1932-12-26,Nueva tecnología convierte cualquier superficie en una pantalla multitactil. http://t.co/EDibLL5V #Microsoft #omnitouch
yzWWr9xKOh,Evelyn Smith,viyhYmkZmd,Incredible Story Under the Sea,1988-12-18,Uiiii Yo Quisiera Ser Tuu #GOOGLE
rh8J2X46b0,David Williams,IRQPrAEeyt,Fantastic Story of the Ancient World,1962-05-21,"RT @tomcolontonio: Didn't it occur to @apple #apple that ppl share iTunes accounts amongst family's ?????
Wtf!!!!"
ATg8T4ToOF,Jack Robinson,6hnISNyppf,Mysterious Journey in the Mountains,1981-04-13,Because you are what you search: Now everyone wants to customize search #Microsoft as well as #MCHammer #WiredDoo http://t.co/HlicKxPV
nHhhJdquqh,Matthew Moore,qfZ3wAaXRq,Magical Adventure Under the Sea,2003-01-07,"China Machado, I was googling earlier the women that resembles my momma) #iphoneartists #conceptualart #google http://t.co/TZvjaQlI"
KSDvEp8Y2H,Lucas Jones,VfmlNSsgTO,Magical Life in the Mountains,1983-11-11,"""Il colpo di genio è stato iTunes non l'iPod in sé"". Quello che #Google e #Samsung non possono capire, tanto meno #Microsoft #sapevatelo"
hLICEHqssT,David Moore,xJca3RJzEq,Incredible Life Beyond the Stars,2010-09-30,"01:50 no #msn e no #twitter 
e #Facebook."
pTyb1c3Vi2,Eve Lewis,80HL5BiMxh,Incredible Journey of the Ancient World,1967-08-07,#LOL #google http://t.co/aeJ1Vrgj
bEoHE9Vpry,Eve Lopez,vPcDsgjSbP,Mysterious Story Under the Sea,1979-12-25,@dwtalker that's some tough competition right there http://t.co/XP9LhjpR #TechWar #Google #Facebook #Apple #Amazon
ppf20nFbmh,Bob White,62u6T010CZ,Amazing Adventure in the Mountains,1941-11-20,"Microsoft releases developer preview of ""Project Roslyn"" compiler http://t.co/igGyeT9S #Microsoft #beta"
LYTrOkzC2c,Olivia Davis,O3Ka30ixt5,Magical Life Under the Sea,1927-12-03,U put w/eva comes to mind on #twitter but let me try n do it ima be a rat or something smh the nerve of dese #NIGGAS!!!!'
dgKUAiYWPD,Aiden Jones,IbqL4jDRru,Fantastic Adventure in the Future,1928-04-28,Now it's time for some Ice Cream Sandwich! #Samsung launched it's latest Android Galaxy Nexus phone powered by #Google
ajCC5mHtG0,Carol Davis,Z8gQI3qcIz,Amazing Life in the Future,2020-11-20,mm but yeo .. #twitter .. free up @_tashaaiWESTEND ! free up @_tashaaiWESTEND ! free up @_tashaaiWESTEND !
NNEn6VuIcP,Isabella Miller,2NjuTGOdFp,Incredible Adventure Under the Sea,1977-02-19,making the switch from @Android to @Apple #iphone #iphone4S #smartphone #stevejobs (@ Apple Store) http://t.co/kj6pJvkH
3dUj56q45D,Jack Davis,VkYn3sYPtM,Fantastic Journey Beyond the Stars,1988-04-19,Proof that my dad loves my sis more. RT @AnnaCorinne16 woke up to my dad at my door w my new iphone. he surprised me & went to @apple!
vxHcPcSje6,Amelia Jackson,42uHMQAoGz,Incredible Secret Under the Sea,2020-01-27,ok it is back @iphone @apple
B1e7FMO0bq,Eve Robinson,yLL3xhB8kr,Mysterious Secret Beyond the Stars,1954-03-21,RT @AppSense: “@Simon_townsend: #Microsoft tests and proves #AppSense enterprise scalability! 78K users on one personalization DB - http ...
VYSuLDs7MF,Bob Miller,5bRH2hLUGK,Mysterious Secret Under the Sea,1913-11-16,"RT @GLaraLopez: The Perks of Working at #Google, #Facebook, #Twitter and More [INFOGRAPHIC] http://t.co/0KcgbMWF #sm #socialmedia #redes ..."
KbmrsO8B75,Eve Perez,5YIsXjhN1W,Fantastic Adventure of the Ancient World,2008-08-29,#Publicidad Galaxy Nexus es la próxima generación de dispositivos Nexus co-desarrollado por #Samsung y #Google l http://t.co/yVWrw98h
jGZWuAQIh2,Noah Rodriguez,iDUU7afUt0,Incredible Adventure of the Ancient World,1977-09-15,@Nikki_BoBo #Twitter after dark
idKyF6HX0W,Grace Anderson,P3RAl088PS,Incredible Story Beyond the Stars,1920-12-31,Fico impressionado como qualquer software #microsoft fode com meu #Mac
fwCZUX2ecH,Emma Davis,VoAzO7fcKl,Amazing Story in the Mountains,1902-03-03,RT @DaveBakerD2L: RT @goVHS: #Microsoft has just released a case study featuring @goVHS and @Desire2Learn. http://t.co/iG4Qm3Sn #goVHS #D2L
IJhpjGu7pV,Bob Williams,vV2u8TUox7,Fantastic Journey Under the Sea,1916-04-21,"Interesting read on war b/w @Apple & @Samsung- http://t.co/Vt9d24Yi -using latter, agree lack of innovation, but better specs at same price!"
fnDG6dJGIk,David Clark,SL521BXTnF,Magical Adventure Under the Sea,1969-06-29,#Microsoft lanza sitio oficial de #Skype http://t.co/pl3kPDla
C2d8abpxrH,David Thompson,UbQY3dzSzV,Amazing Journey Under the Sea,1970-02-07,"shit, shit, shit. IOS5 update ate all my apps, data and media just like @apple said it would. This is going to take some time to rebuild."
yBKDuzzyLX,Ethan Jackson,egxugT6MSf,Fantastic Secret in the Future,1955-09-30,Cracking the Code: Using QR Codes to Engage Your Customers on Their Smartphones #smb #smallbiz http://t.co/IL1u0v8v #microsoft
5OzEw1luAW,Daniel Lopez,osnJhx5Wo9,Incredible Story in the Mountains,1977-06-01,Microsoft applies for celebrity search patent #microsoft #bing: Microsoft has applied for a new patent that take... http://t.co/4qoQqDCY
yXCduoT4dw,Mason Gonzalez,0XErCm9vtV,Mysterious Adventure Under the Sea,1908-12-08,"Is #Google Down? http://t.co/wFrzKYsN via @Ejunkie Good for #Bing, #Microsoft ’s investments paying off"
7UPkvzmPfx,Olivia Rodriguez,yIpm2wOAFV,Incredible Secret in the Future,1988-08-31,RT @cmaneu: #stage #Toulouse #Microsoft #net #SuperBoîte #Win8 #geeks = http://t.co/7UHSLQII (Please RT ;)
lYbVU388nk,Isabella Gonzalez,ovxULIHjKt,Mysterious Journey in the Mountains,1958-08-21,Good god the camera app in Icecream Sandwich is amazing.. and that camera is FAST!  #samsung #google #android #galaxyNexus
SAXWijj6a7,Sophia Williams,A1P6d6CeRK,Amazing Adventure Under the Sea,1978-06-16,Google updates Nexus site with Galaxy Nexus details http://t.co/LaSn4ol0  #android #google
sOy0QmQvgj,Emma Jones,mWO8gmgVtR,Incredible Journey Under the Sea,1991-12-12,"""#twitter's dumb, I don't like it.""  Hush up, Justin."
Nj3VOmqirl,Isabella Rodriguez,Qf5yhbtEaI,Incredible Story of the Ancient World,2021-02-18,"Ok, so it was a lion and not a leopard. Too much upgrading this weekend. @apple"
gJtvL8wkCj,Liam Lee,pHQvMhu8g7,Mysterious Story in the Future,1943-09-19,"RT @GroenewegBV: Steve Ballmer haalt uit naar #Android http://t.co/LlIxBzeV #nuandroid Dan ben ik ook een nerd, ja daaaaag, slecht zeg v ..."
2AnEjuxvX3,Emma Thomas,u8N6bbhQDb,Magical Story Under the Sea,1903-10-26,"#Twitter ya vale 8,000 mdd http://t.co/gqxbJO7J 4.1 millones de habitantes en México tienen una cuenta"
knYx3Ss7k3,Ivy Harris,swwb0nh8Q3,Fantastic Story Under the Sea,1910-11-16,@ppmorraz hahaha esos chistes de #ninel se han vuelto famosos en #twitter
ixnUXYGA7j,Olivia Hernandez,dDQlVwDPk0,Fantastic Life in the Future,2017-03-18,@apple u guys are gay
qrDz7kWaT7,Henry Perez,lNjRpuDyME,Incredible Life Under the Sea,1957-02-15,"RT @SE4mCom: المؤتمر الخاص بجوجل وسامسونج يبدأ خلال الدقائق القادمة 
http://t.co/WUF65DTr #SE4m #Google #SAMSUNG #follow_up http://t.co/ ..."
USrtWFAk6n,Matthew Hall,Ka1ywGSkWk,Mysterious Adventure of the Ancient World,2013-11-11,RT @SHlFT: dear #google & #samsung... learn some presentation 101 first. please.
4OTK9PRawy,Ivy Garcia,NoNlkBPh3W,Mysterious Adventure of the Ancient World,2017-12-24,@apple just got the new iOS5 upgrade with iMessage...good luck surviving now @BlackBerry
fv2c5RSmn9,Charlotte Williams,BFZSaS8L46,Amazing Journey Under the Sea,1914-03-16,"@allyfish87 leaning that way for battery. Have #Microsoft xbox, media pc and zune so would a Droid fit better? #idk thanks tho :)"
qI759bYlVs,Daniel Lewis,gM6E7PQs1m,Fantastic Life in the Future,1941-03-23,"[aa] , suavi bando de cornos & cornas , nun desejo boa noitte pra min , uma maldição pra voçs viciados en #Twitter , haha ++"
iW8KdjQDWF,Liam Hernandez,sgvriSrpkd,Incredible Secret Beyond the Stars,2010-08-30,@8_ivonne @1_Ddanille  ahhahahaha noceee asaber porq me llamo y digo ke me cnectara a #twitter pero niiiiii cntestaaaa-!!!
zInbEu6HZv,Ivy Walker,jbWuMTTueJ,Amazing Story Under the Sea,1999-12-22,RT @laurentalbaret: [2.0] La recherche cryptée (sur #Google) étendue aux utilisateurs connectés à un service Google http://t.co/K8oalek2
VTvbZ43TdP,Aiden Wilson,fM5Mu7Nywk,Fantastic Life of the Ancient World,2018-06-07,"#Microsoft CEO #Steve_Ballmer on Not Buying #Yahoo: “Sometimes, You’re Lucky” http://t.co/D0u2o9nZ"
cdCDAumh5Q,Aiden Thompson,XlVYhteidc,Incredible Adventure in the Future,1959-09-19,"@siobhancoda is your anti virus isn't just a 90 day trial, could leave you exposed in the near future #free #microsoft #antivirus #software"
l2VLgZGQq5,Grace Lee,pvudKGKINT,Amazing Journey in the Future,2005-01-27,#twitter off!!...
dblGXlmSI2,Bob Hernandez,cDjy36XbXm,Fantastic Secret Under the Sea,1964-06-22,#Europe Approves #Microsoft Takeover of #Skype -http://mrkt.ms/r9CGEO #UK #London
GpO6Z8jLZw,Lucas Thompson,3lL74KGZ2r,Magical Life Under the Sea,2002-06-30,Check out this Interesting Blog on Tips from #YouSendIt 4 wht 2 Consider When Migrating 2 #Microsoft Exchange 2010 http://t.co/yLF30h0h
c3q81HEI3w,Frank Lopez,Ud9OD4v65W,Fantastic Journey in the Mountains,1963-03-21,Nouveau layout pour la Galerie qui est en forme de magazine #google #nexusprime
WOdR08xSsP,Evelyn Thomas,KgHxwoxYft,Mysterious Secret in the Future,1986-05-22,@SGarney I put the picture up on #twitter. I did it cause everyone on twitter is cool and your not. #getsamanthaofftwittereveryone
ZTVz59p76G,Logan Miller,kp9jlOJGfs,Amazing Secret of the Ancient World,1945-04-08,C meus amigos do #Twitter a maioria do Brasil eu tenho dificuldade p um chat qdo trabalho se madrugada! #horariodeverao no!!!
KqgwtoJNEV,Abigail Jackson,wrWsu5EVQr,Fantastic Secret of the Ancient World,1900-11-11,Típico que el #Facebook a esta hora aburre y el #twitter me desvela
b6ejfAzwo4,Evelyn Martin,139XTOBUwR,Amazing Life in the Future,1918-02-09,#TeamFollowBack #TFB #MustFollow #MF #FollowNow #FN #FollowFriday #FF #IFB #Twitter #Follow @Only1DeejayER &lt;&lt; oooh DAMN nice pic!!! #Ladies
tRGQspcBv0,Grace Gonzalez,H3RsQ5Wszy,Fantastic Life Beyond the Stars,1997-09-13,@Obamaphile @vegascharlieb your not in #twitter jail again r u ?
bwf4n7bVET,Amelia Thomas,0s3SJMPmmG,Mysterious Adventure Under the Sea,1941-03-02,#Twitter #twitter :)
vTkjn0SVJx,Sophia Johnson,NqAAQyq6A0,Amazing Secret Beyond the Stars,1984-05-14,#Microsoft #Dynamics #NAV is a cesspit. Extreme consultingware. To be avoided...
0mJisnXwBW,Matthew Lopez,f4ZSzxdnUK,Incredible Journey in the Mountains,2017-09-05,#OmniTouch #Microsoft  http://t.co/qwk0YUrH via @youtube
mGeK9Wf8pj,Alice Williams,oxAvMU7n0j,Fantastic Adventure of the Ancient World,1988-08-29,"@KushKitty420 you, #Facebook #twitter and the #tv are all #distractions whenever I wanna study ;("
3CDWYrCybb,Jack Perez,m8oABa8QZm,Incredible Journey Beyond the Stars,1912-06-28,Would you look at that.. @SouthwestAir does @Apple style welcomes as well. http://t.co/t0TrFnk8 #customerappreciation #custserv
WPVdczOprT,Grace Robinson,4I4oK0Yd3i,Fantastic Life of the Ancient World,1907-10-04,"Thanks 2 my new #Twitter connections! @ecogreenvalet1,@brunodgama,@inez260,@moniqueprothero,@leviti09,@ChristyJBPL,@TonyMicheal, Chk Em Out!"
7zceUkOH5n,Sophia Robinson,JwD1qv4cHJ,Magical Journey in the Future,2009-11-05,"Ever since I cleaned my Mighty Mouse ball with alcohol to get it rolling again, any time I click the ball it acts like a left click. @Apple"
EVe0zF1KeE,Isabella Jackson,PQSaQCd0Ox,Amazing Journey in the Mountains,2002-09-03,Parece que hotmail is down #Microsoft
uiDbnozbRB,Frank Brown,dtCMtDMNsQ,Mysterious Adventure Beyond the Stars,2023-12-04,#ALG Culminando formación en #Microsoft M-2778 y en #IndicadoresDeGestión.  Gracias a nuestros clientes por su preferencia. www.alg.net.ve
uhWlpGkhoB,Jacob Thomas,M2DX9bRuHo,Fantastic Secret in the Mountains,2007-01-12,#Google lanserar #Galaxy Nexus - tillgänglig i Europa från och med november: http://t.co/fVyNoW2p
BG3atPiWMh,Mia Lewis,ZhPT4B5jSm,Amazing Adventure in the Future,1937-04-14,"Not sure how I feel about the Black Keys playing at the U-Village Microsoft store. Guess they *are* getting paid, that's good. #Microsoft"
wkg39abYdy,Isabella Martinez,gRxuRnsZ0G,Mysterious Adventure in the Mountains,1996-05-01,Welchen Vorteil bietet G+ für #Facebook? | basic http://t.co/DLvTboeK #Google
ILQ7EAKJyf,Mason Garcia,PdG14888JY,Fantastic Life of the Ancient World,2012-12-27,#Google+ llega a 40 millones de usuarios aunque su problema sigue siendo la poca permanencia en esta #RedSocial http://t.co/ntS7GXqV
IcYtcmFhPE,Mia Thomas,cUv1wHudSd,Fantastic Life of the Ancient World,1949-02-10,Bah! Genius BAR // RT @edatpost: .@Apple fan Eric Holder spotted at the Genius Store http://t.co/FTLttLPn
O0Lx0mfmZm,Ivy Thomas,8GwBzIDnMa,Incredible Life Under the Sea,1990-10-11,O poder de #pensardiferente: a mágica de #SteveJobs foi transformar egomania e obsessão em trunfos http://t.co/qkUoeEzv @apple @ipad @ipod
9NTEDmuObr,David Garcia,6UTx6JRDLa,Mysterious Journey Beyond the Stars,2021-05-07,RT @imason_inc: Search Governance in #SharePoint 2010 http://t.co/dPlbPQHO #microsoft
DNWMjkkg0r,Emma Lewis,zoRfQOum42,Magical Secret in the Future,2017-03-12,The competition: #Google introduces #Android 4.0 Ice Cream Sandwich and the Galaxy Nexus http://t.co/4vGGHF43
ubs3j3yg7C,Alice Harris,Cbtq7DFZO3,Fantastic Secret Under the Sea,1972-05-04,#ALG Culminando formación en #Microsoft M-2778 y en #IndicadoresDeGestión.  Gracias a nuestros clientes por su preferencia. www.alg.net.ve
WACcGYNL1Z,Matthew Rodriguez,GpIGmNK1ga,Mysterious Journey of the Ancient World,1911-06-17,"msn, quase ninguem, facebook paradão geral despedindo, #twitter geral ralando :S'"
EUrYFvRyNZ,Noah Hall,rzyfXx7j1o,Magical Journey in the Mountains,1974-02-28,"As far as I can tell, Google engineer Steve Yegge never intended to become famous for criticizing the c... http://t.co/SO1rCq0y #Google+"
S1psiHOmM7,Lucas Hall,tOyeno1OJl,Fantastic Story in the Mountains,2002-02-03,#Twitter Hoje ta #BONBANO só #ELITE poooha
wdTM1zJfzL,Alice White,bCHui6StAx,Magical Story in the Future,1983-03-18,If @Mr_A_Johnson is up. #twitter is gona have some technical difficulties
PT3N3oXZwd,David Perez,S3u057W2AL,Mysterious Life in the Future,1919-02-09,hahahhaha´ no puedo usar el #twitter por laa compuu
mphIVVHBxY,David Jackson,behXaPeEYH,Fantastic Life Beyond the Stars,1922-03-28,#Facebook prepara una aplicación para controlar el consumo de energía http://t.co/ritcdsD2 #Google y #Microsoft dejaron proyectos similares.
xqVYlykdAc,Mia Martinez,7T1OsNF1UQ,Incredible Secret Under the Sea,1986-01-14,"Zie ik net dat ik volgende week samen met twitterloze Karsten naar een #prospect in #Ridderkerk ga om te praten over, #Microsoft #licenties."
49dYad8dhw,Ava Martin,FuGS5GVZYA,Incredible Secret in the Future,1918-06-05,Pinball FX2 offers free 'Paranormal' table starting next Wednesday http://t.co/vYXqUbJg #microsoft #pinball_fx_2
WKztuL9wn5,Emma Harris,gq4PQ2bwfp,Amazing Journey Beyond the Stars,1942-05-20,"Et de 3 #fails, mais au moins c'est du vrai direct #google #nexusprime"
CnHIv6D6Qw,Frank White,WyBExL2mre,Incredible Life Beyond the Stars,1970-01-29,"Codename or not, awesome or not, I have a hard time taking ANYTHING called 'Ice Cream Sandwich' seriously. #google #android #sticky #melts"
k6c6OLMuI0,Lucas Hall,YJTAt0X32j,Magical Secret of the Ancient World,1934-02-26,@RhiannaRaee hanging @apple in tacoma listening to the beatles!
vUPSU1HTPh,Matthew Hall,1yYHX9FNpR,Amazing Secret Under the Sea,1931-03-10,Jet Car Stunts Xbox Live game for Windows Phone released http://t.co/O3hYxBxh #wp7 #xbox #microsoft
YHmH1EXaQw,Frank Taylor,wjOjLiFks2,Incredible Life of the Ancient World,1961-05-21,Haven't been on this Twitter shit in a while man. Here because looks like #AboutThatLife be haven hella fun on #Twitter
CFbI5CitRO,Mason White,fyWfkWVhsk,Fantastic Secret in the Mountains,1963-08-30,oh. kita anak baru ni ya... ceritanya di #twitter ni ..
TfRLSWQC7S,Bob Harris,vCzJjWoreD,Magical Story in the Future,1980-05-19,#Google + #Samsung = Perfect #Icecream sandwich #GalaxyNexus
99uayk6rhS,Charlotte Hall,SbjIMCiYIy,Incredible Adventure of the Ancient World,1947-05-20,@boothelk did you know the first @apple home computer to use a mouse was called 'the lisa' ??
Kh3Y1I87OG,Jacob Perez,C2heIMc2OL,Magical Story of the Ancient World,1937-02-21,Skype and Microsoft Team Up - A match made in heaven? - http://t.co/lsFTp8RL #microsoft #skype # videoconferencing #socialmedia
2r7XVSNH2V,Jack Clark,Jcgij3F9ku,Fantastic Secret in the Future,2009-03-30,@iley_little we'lll figure it out tm in gym #google
CDtgx8KFl4,Charlotte Perez,nCpuTpK1Qo,Amazing Story Under the Sea,1982-12-27,Suppose Microsoft Had Bought Siri? - Forbes http://t.co/ZRYNdhDi #apple #microsoft #siri #msft
KY5XJGHKsG,Bob Wilson,yYnA89qcD4,Fantastic Adventure of the Ancient World,1924-08-25,"#SEO Tip:Google considers the first lines of the page important.Put menu,headers+important text on top. #google"
FNi1G2AaUV,David Johnson,B61IywnHKm,Magical Journey in the Future,2002-08-10,#Samsung #NexusPrime esta wwwaaooooo y con #IceCreamSandwich superior @samsungpty buena presentación #Android #Google
JEsTsdvoLa,Bob Jackson,R3d7v8cQym,Amazing Story Beyond the Stars,1968-06-07,Director de #Microsoft admite que fue afortunado el escape de la compra de Yahoo! http://t.co/ZX3dLElI
d94vjoPq1t,Grace Brown,hlT1qDoDKn,Mysterious Journey in the Mountains,1946-01-24,@DanielaS04 :) eso!!! #Google+
WCBGMfwAnj,Jacob Clark,HoZ4CLwKVc,Fantastic Life Beyond the Stars,1920-06-08,RT @Startpack_en: Guys from #Microsoft tell #Startpack developers about how to integrates with #SystemCenter via web services. http://t. ...
