Blog_ID,Author,Author_ID,Title,Publication_Date,Blog Text
ehHGiciC8X,Sophia Miller,deDWmsvMYF,Incredible Adventure Beyond the Stars,1980-03-31,Apple vende 4 millones de iPhone 4S en tres días http://t.co/FH5T5Mi6 #turismo #martesviajero @apple
3n8fXGvTjC,Mia Garcia,Yrvwdcfobz,Mysterious Secret in the Mountains,2022-03-13,#Follow my main #Twitter @AikoChristine need more #followers help me get to 500
feOyemUtMd,Alice Perez,VjIkAnic4D,Fantastic Story in the Mountains,1943-03-23,Panoramas sur ICS ! #google #nexusprime
L3E8lt4MIg,Jacob Clark,wZttY6tStH,Mysterious Adventure in the Future,2020-09-27,RT @CNNEE: #Skype ya es parte de #Microsoft http://t.co/f54UXNwi
Go8fugqi46,Mason Wilson,laXMSreCL9,Incredible Life in the Future,2015-03-16,@BrianMincey @apple the chipsets tear through battery life. Coworker has a htc thunderbolt that he gets about 3 hours of life.
NoUZ7giIXX,Bob Wilson,oc9RS7oqzR,Amazing Adventure in the Future,1958-10-28,Mi sueño dorado es que #Microsoft se vea envuelto en un quiebre absoluto en sus productos y servicios
dA4vAn6zuW,Logan Perez,jyYy9BckmP,Amazing Story Under the Sea,1915-03-14,#Microsoft chief admits lucky escape from buying Yahoo! http://t.co/xOqL8Wqh
KreVyeJpkv,Daniel Smith,aRopnq3PKq,Fantastic Story Under the Sea,1938-06-06,POLL: http://t.co/Wu6EsvT5 Q:Should @Microsoft consider making its own hardware for #Windows like @Apple does? #Microsoft #Windows #Appl ...
8MKQjT4vEo,Noah Lee,d3bAgTB6ol,Mysterious Life Under the Sea,2013-10-12,"#TOMANOCU EU SIGO GENTE QE SO POSTA COISA EN CANADEIS, UOL, #twitter doido --`"
MFZaVR4aZG,Sophia Robinson,KCdUubdG0g,Amazing Secret Beyond the Stars,1917-05-30,Buenas noches #twitter
qlri3mNgdv,Bob Anderson,B26bQP81Dy,Amazing Journey in the Future,1910-07-21,RT @eboyee: Dostupan SDK - WOW R.E.S.P.E.C.T. #Google #IceCreamSandwich
OHjC6Pv6tL,David Thompson,4ovlmfbfVU,Amazing Journey Under the Sea,1974-01-26,"""Não sou viciada em dorgas nem em alcool mais sou no #Twitter fato"""
YVqcGQwZlr,Amelia Lewis,UINR96FdRQ,Amazing Life of the Ancient World,1917-06-15,"#Android #Google Official Galaxy Nexus Site Goes Live, Highlights Ice Cream Sandwich And Galaxy Nexus... http://t.co/4ijvupvq #DhilipSiva"
7quSNByN7Z,Liam Harris,81urUB6wIC,Amazing Story in the Future,1980-01-31,"Yeah, there's no @apple twitter account."
jtKxMCsMtz,Jacob Hall,AGb6kzeeFR,Mysterious Journey Under the Sea,1973-03-26,"HNews: Google, Samsung unveil Ice Cream Sandwich-powered Galaxy Nexus http://t.co/elh77r4p #google #.net"
4hRDSLYJlR,Logan Lopez,3l2BJp1BIl,Magical Secret Beyond the Stars,1952-03-26,Steve Jobs Biopic Coming Soon - @Apple #Apple #SteveJobs http://t.co/DxZBa5bG
ICKPN4fcyg,Henry Thompson,CPYzAUX3S0,Incredible Secret in the Future,1929-09-23,"Los fabricantes de móviles y su integración con las redes sociales: Sony Ericson apunta a #Facebook, Apple a #Twitter y Samsung a #Google+"
jY1av0BBSo,Mason Taylor,LFuejsOBOI,Incredible Story in the Future,1923-04-26,"RT @MichaelKroker: Steve Ballmer: #Nokia to reveal multiple #Windows Phone devices next week, #Microsoft may make their own - http://t.c ..."
YyHLnnjpIb,Emma Smith,Ht1F6qekLt,Incredible Secret Beyond the Stars,1974-07-22,The awkward moment when google #chrome take a hell of a lot time to load #googleplus #google
8PCG9LflJf,Ethan Martinez,0u4BkD8K73,Incredible Journey in the Mountains,1938-05-10,RT @bytegadget: Video oficial del #GalaxyNexus y especificaciones – El nuevo #smartphone insignia de #Google y… http://t.co/Rvn0oFWy
PbBhDOjMXN,Jack Lopez,AiBifh9jwF,Magical Journey Under the Sea,1991-11-24,Sigue ah @KhrizJoohn  con su nueva cuenta en #Twitter
nIQhiCX978,Carol Perez,eLflp2FTXD,Mysterious Life in the Future,1983-05-23,Gotta say the @Apple itouch iphone shuffle etc.. sound quality is AWFUL.. painfully crap. Its been a downgrade from @Sony sound quality wise
wi3U2zMxYb,Matthew Thompson,f4Kyh0N6i3,Magical Story of the Ancient World,1981-12-15,Lmao RT @RobynheaRtz: He asked Siri where's the hoes at & she told him where the nearest escorts were I love @apple
xxnnRpfgUl,Emma Johnson,o8092iabpj,Fantastic Secret of the Ancient World,2002-06-11,"Tengo que bancar propaganda de política en la calle, en la radio, la tele, panfletos en mi casa... ahora en #Twitter también? no rompan!!"
zf3GapXIBG,Grace Davis,HwgeZtTtQg,Fantastic Adventure Beyond the Stars,1969-09-27,#Android #Google Google updates Nexus site with Galaxy Nexus details http://t.co/BeckhmA1 #DhilipSiva
MDU53UuUJw,Bob Jackson,mA9YNSz679,Fantastic Life in the Mountains,1978-08-21,"RT @HaendelBalzora: dear @apple please invent ""FaceTime Voicemails."" sincerely, haendel balzora jr. #apple"
5mDvXZC75z,Logan Harris,2iJl49SmjT,Amazing Life in the Future,1939-01-27,@oriondesarrollo en todas las #redessociales ahora también en #google+ http://t.co/z5oXYc0y
hR9k1jDXqm,Evelyn Robinson,2uky5ZkY43,Fantastic Secret in the Mountains,1954-02-18,Wow jus made a #TWITTER i reallly dnt kno how o2 use it so i neea alittle help
VwzZeEiYDq,David Garcia,40A3JSSPj5,Magical Adventure Under the Sea,1944-04-04,first thing on #google's to do list: hire a performance coach.
wW9TYoHUJF,Grace Rodriguez,GDcOmYyV0X,Fantastic Story in the Mountains,1932-11-17,"Welp. RT @Tree @Apple you didn't fall too far from me, huh? RT @NikkiNotNiki Nia Long's mom is gorgeous.."
nNOslG1S63,Alice Davis,yupkAO3AV2,Incredible Journey of the Ancient World,1937-08-22,"#Microsoft - We put the ""backwards"" into backwards compatibility. #instantfollowback"
QuyoVCmRVo,Sophia Robinson,0A7VZ2rRu3,Magical Story Beyond the Stars,1979-01-14,"http://t.co/J3p3KYHf
#Apple #Google #Microsoft #Blackberry #Nokia #HTC #Samsung #Motorola #WindowsPhone7 #iPhone #Android #Droid #Tablets"
72zXfvW541,Jacob Hall,0VVhZ0EZmw,Amazing Secret of the Ancient World,1980-04-03,"#Samsung #Google announce new phone and then the #Apple #AppleStore goes down.

A little strange or am I reading too much into this?"
aEoA1m6rN7,Henry Garcia,wACTUjtSM5,Incredible Life Beyond the Stars,1925-07-04,#Google 跟 #Samsung 今天發佈使用 #Android 4.0 作業系統的 #Galaxy #Nexus … 接下來，蘋果及 #Microsoft 會告兩者侵權嗎？
qPFjR9JKfm,Evelyn Taylor,QiEvFFnupy,Fantastic Journey Under the Sea,1902-05-18,"@immad_immad #google, always thinking ahead"
RCwJU4SLTA,Bob Robinson,ptN8xXyHX7,Fantastic Journey in the Mountains,1998-04-07,I have to change my homepage from @apple.  Steve Jobs looks like an owl
7Nhfprqs1Q,Abigail Robinson,rrAReltwL5,Incredible Life in the Mountains,1941-07-26,@SincerelytiGG_ I guess dat wat #twitter does lol
jXi8t3HMlx,Ethan Brown,TB5Ns1kyZw,Fantastic Life in the Future,1977-06-13,Epa!... Pa' los que estamos estrenando #twitter @RogerAlexiis jajaja  ✔
6U1jWYKalv,Matthew Jones,hNLAJyE3ZI,Mysterious Story Under the Sea,2003-07-27,"@bruna_rafaelah xau amanha eu to d volto com meu #Twitter
COM FE EM DEUS
#TwiTTerOff"
O12DZ3JRpq,Carol Jones,jGtd5aaYMw,Fantastic Secret in the Mountains,1998-07-06,"rilasciata la CTP di Roslyn, l'API ""compiler as a service"" per C# e VB http://t.co/EfGDBBUW #microsoft #roslyn #ctp"
T7MgX38MJa,Daniel Garcia,ffxUQoiSyv,Magical Secret of the Ancient World,2015-12-16,"#epicfail @apple bij upgraden naar IOS5 instellingen kwijt en ebooks verloren. het kost me dus geld zo'n upgrade, WAARDELOOS!"
UXQv2chBDg,Liam Gonzalez,QL2GKOW1np,Incredible Secret Beyond the Stars,1954-03-13,#MichaelJakcsonQuiñonez wowo ya es un tema muy comentado en #twitter
P0UecLLNjC,Liam Miller,oPsa7O81Mb,Magical Story in the Future,1943-09-19,“@CBM: Lies @apple. the battery on this new iPhone4S is definitely not any better.” &lt;&lt; check Settings: 8 times more App usage in iOS 5
AVZy7rJpuS,Matthew Martin,M4e0u6fuKN,Magical Story in the Future,1913-10-26,Image update &gt;&gt; : AIDS ad campaign : use condoms -  http://t.co/qZqblIZB #funny #humour #twitter
JqhuEs7Z3k,Eve Thompson,APY2HtdTkf,Magical Story Beyond the Stars,2006-03-12,"RT @shanmoorthy: Next year is going to be really interesting in tech as @Google, @Amazon, @Facebook and @Apple vie for new growth areas  ..."
EBzya7qsol,Grace Rodriguez,GwVzlTyDuD,Mysterious Journey in the Mountains,1996-06-04,Sunaa karo merii jaan in se un se afsaane / sab ajnabi hain yahaan kaun kis ko pehchane #Kaifi #Shair #Twitter
PwPCLirse8,Jack Hernandez,UFVb1cYPKT,Mysterious Journey of the Ancient World,1992-05-24,Saaindo aqq ;*   boa noite #twitter !
bmC2LxcG4H,Evelyn Miller,bcbVDmH4Tw,Amazing Secret of the Ancient World,1958-03-29,Que raroooo en #microsoft les funciona todo menos el departamento de bajas... Que casualidad!! Veremos mañana
Zwjm8RJC8L,Daniel Johnson,P3NIQctW72,Mysterious Story Under the Sea,1914-09-10,#Google People app...the next revolution in stalking.
0lGozAdH3p,Sophia Anderson,2pBKQSN6K6,Incredible Secret in the Future,1963-03-26,Check out our newly revamped Testimonials page for more information on how #Microsoft #Dynamics #CRM can work for you!  http://t.co/hmT51bdf
dh0iobgSfX,Charlotte Lopez,7zki8Jv3nz,Amazing Journey in the Future,1932-10-12,"En España, se pasa más tiempo en sites de #Microsoft que en #Facebook y que en sites de #Google... http://t.co/zXYauNAq via @TreceBits"
QRrfgdigCA,Logan Taylor,HQCVmAyFH2,Magical Life in the Future,1906-05-29,"After a week or so with @Apple's #iOS5 I'm considering going back to #jailbroken 4.2 - same features as 5, plus more. Not as stable, though."
Torji0pRVh,Ava Jones,2ARnnY26y2,Amazing Life Beyond the Stars,1958-10-11,@Apple received 1m pre-orders in a single day for its new iPhone 4S #consumer_demand #steve_jobs
Hr8HDMPbVN,Eve Davis,6A8HRKV02M,Fantastic Secret of the Ancient World,2023-07-17,Many new features for Android. #NexusPrime #Google
4QmRTNcOQs,Noah Wilson,qmZ42pL0Kz,Fantastic Secret in the Future,1946-12-30,#Samsung Galaxy #Nexus / #Google #Android ICS 发表会重点整理 http://t.co/u7ViMWl6 #galaxynexus #galaxynexus
jcNyIuFNw0,Alice Davis,TmgO6GZLXC,Incredible Secret Beyond the Stars,1906-10-03,@apple Why don't you have a wireless remote for Keynote presentations w a MacBook Air?  Nobody wants to see the pith man navigate w a iPhone
C6c7oHqXEP,David Smith,55wAeKWW1a,Magical Adventure Under the Sea,1993-09-06,"I Feel Like #Promoting Anyones #Twitter Page (♦MENTION ME IF YOU WANT TO GET #PROMOTED♦) [ #PromoteBack ]
#Followback"
GH7XFOEczM,Ethan Hall,keF6CNfhOS,Amazing Journey in the Mountains,1912-10-27,Busco más Desarrolladores C# con experiencia también en #Testing para proyecto en #Microsoft http://t.co/IHKhqUQ8 #net #RRHH #empleo
QOTmuTIJIN,Bob Hernandez,hO5Qn0IceP,Mysterious Story in the Mountains,1956-08-06,RT @thedroidguy: #Google announces dates for 2012 IO http://t.co/90xoKyQN
z6uAya4j14,Alice Thomas,olaz7yKaW6,Magical Secret in the Future,2002-08-11,Porque mi app de #Twitter para #Android no actualiza las menciones?
LA4WuwTsZ4,Eve Wilson,iOtgAgGFcx,Magical Story Beyond the Stars,1954-08-11,@8_ivonne @1_Ddanille  ahhahahaha noceee asaber porq me llamo y digo ke me cnectara a #twitter pero niiiiii cntestaaaa-!!!
UVXKd3YfpG,Evelyn Lopez,BvnfWsl7cb,Incredible Adventure in the Mountains,1920-02-17,Use o Twitter Profissionalmente! ~ Dicas E-Commerce e Renda Extra!: http://t.co/k6yAfacy #Twitter #Blog #Ecommerce #Brasil #Marketing
lgGR8BJEjj,Frank Perez,enj5ZYtx2W,Mysterious Journey in the Mountains,1930-10-19,#Osea jajaja me entero que ahora en el #Twitter se blokea gente mis supuestros primos me blokearon #Lol
9ImitUcF23,Daniel Gonzalez,8vZobeXwl9,Fantastic Secret in the Mountains,2020-07-29,#Publicidad Galaxy Nexus es la próxima generación de dispositivos Nexus co-desarrollado por #Samsung y #Google l http://t.co/yVWrw98h
bAPzYwE4Cm,Logan Davis,3idxru8SWm,Amazing Life of the Ancient World,1901-02-22,@samixitoledo jajajaja pero no kiere decir q m vas a dejar de hablar adems el mio amore no tiene #Twitter. Jajaja
nJpAC2FZ0H,Abigail Walker,MtWqLRVEeO,Fantastic Adventure Under the Sea,1961-08-18,"http://t.co/ONI0JX8B
#Appleagagné #Apple  versus #microsoft"
fgUVTpSHHY,Frank White,IHEiF4i4dr,Amazing Journey in the Mountains,1917-11-22,"Andy Rubin de #Google develó oficialmente el Samsung #GalaxyNexus, 1er smartphone con #Android4.0 Ice Cream Sandwich http://t.co/dKGCvjsG"""
0pGO7dRYCC,Mia Anderson,SzS6a3AP9a,Magical Story of the Ancient World,1938-08-21,RT @twandroid: Possibilité de voir les mises à jour (un peu comme Sony Ericsson avec l'intégration Facebook) #google #nexusprime
KT6uddDqhK,Matthew Thomas,EGk9cj6fyZ,Fantastic Story in the Future,1945-12-15,"Congrats to the 5 big #winners of the ""Get certified-Get happy"" #Sweepstakes!  EZ log-in&gt;Contests&gt;Winners:  http://t.co/396AtoHF #Microsoft"
Xh35MgDgtv,Ava Harris,gnkz4MlZUq,Fantastic Journey in the Mountains,1928-12-06,Easiest way to use Evernote with iPhone 4S Siri. Just tell Siri to Email Evernote and say your note. @evernote @apple #evernote #siri
Knmrci9Rlx,Frank Thompson,N727bSkvoR,Mysterious Story in the Future,1977-09-12,[WebProNews Finance] #Yahoo Revenue Drop Attributed to #Microsoft Deal http://t.co/EOrOSstX
TBgpwJjDF8,Noah Johnson,fuLH8mEJl9,Mysterious Life Beyond the Stars,2007-04-10,#Android #Google Download: Android 4.0 Ice Cream Sandwich SDK System Dump http://t.co/VyyAsBM6 #DhilipSiva
50xTuI9iXR,David Rodriguez,1qDJB0Dfk6,Incredible Adventure in the Mountains,1981-02-08,RT @pretty_browniee: #oomf gone get it next week i promise! Man you better #Google tht!!!
bFRnrh4eiw,Emma Walker,OSSNYUfJJH,Mysterious Life in the Mountains,1980-02-19,"#Buffalo, #Intel, #Microsoft, #IBM are the best pavilions at #SMAU"
7bncR0Atkb,Daniel Robinson,qtycrug1bv,Magical Secret of the Ancient World,1963-11-06,Android #ICS predice cuál será tu gasto de datos y te advierte o bloquea para que no gastes más dinero! #tecnologia #ciencia #google
PgOvuFUISW,Ivy Moore,jG6DnLkQHo,Mysterious Journey in the Mountains,1986-02-08,New post: Touch Everywhere http://t.co/KKDup8v1 #microsoft #research #touch
x68UWtWuOP,Lucas Walker,6sL3udtGIV,Mysterious Journey Beyond the Stars,1952-10-10,pensando seriamente em excluir meu #twitter
qfDE2BCL3f,Logan Robinson,HugQE9UXCn,Amazing Journey in the Future,1910-04-18,#Twitter Thank you.Read those great tweets.helps live better! :) Bows.
AR43xWap7D,Amelia Moore,bLAarO2VQw,Amazing Story of the Ancient World,1912-06-14,“@GeeCloud: Congratulations to Softline Pastel (@SageGroupZA) for winning #ISV of the Year at #Microsoft #partnersummit” @SoftlinePastel
A3FRvxgxpc,Lucas Perez,FdxBVf3oY0,Amazing Secret Beyond the Stars,1972-04-21,#Google lanza #Android 4.0 http://t.co/NZ494v4h también conocido como Ice Cream Sandwich y Samsung lanza el Galaxy #Nexus
R2zcDLJbF1,Lucas Anderson,lQuLmJNvAo,Magical Life in the Mountains,2019-01-03,RT @extremejohn Stuck on Facebook? I’m so sorry.  http://t.co/aGHbaQmn #Twitter #Google  #Facebook
s9dZLIGFaC,Evelyn Brown,f3kcQQhIkw,Mysterious Journey in the Mountains,1904-03-20,Installed io5 - fine on ipad but wiped wife's iPhone and restore from backup failed! #Bigtrouble #help @apple
kgGEE7HXCD,Ivy Walker,tTjmbzyFvH,Incredible Secret Under the Sea,1967-02-27,Microsoft CEO Looks Ahead at Social and Mobile Plans http://t.co/KFwQ8r4T #Technology #Microsoft #Nokia
Zx1ZzQQWof,Lucas Thompson,DY3vr7yhhP,Mysterious Adventure of the Ancient World,1912-07-24,"Consommation data affichée dans les paramètres, avec même une approximation de la consommation future !#google #nexusprime"
2aEs9zAZJk,Mason Anderson,ClEoWIph7I,Magical Secret in the Future,1991-04-30,Can someone plz explain to me whhyy @apple is only distributing 2-3 phones per day to the sprint stores. I'm really ... http://t.co/uf9taK8f
W4d6WNc92T,Olivia Wilson,tYkcRC11RS,Mysterious Journey Under the Sea,1949-12-26,RT @ajrogers Purdie Rogers tribute to #SteveJobs and @apple. We spray painted the Macintosh Plus w.. http://t.co/oMXjhZh0
pE15EYqkr8,Lucas Thompson,B2T3zaCQCQ,Amazing Secret in the Mountains,1989-03-29,I am quickly falling in love with #Apple #iCloud. Finally a web-based solution to wave my old #Microsoft Outlook bye-bye
Psw0ffKuRz,Mason Johnson,7CPg6eJTGp,Fantastic Journey of the Ancient World,1939-04-25,Whats a good #twitter ap for #iOS that links to #FB accounts to post links? #help
AffjRKREpI,Mason Harris,WIFOHBMFTR,Incredible Journey in the Future,1904-12-30,Dear @apple: Integrated tweeting in ios5 RAWKS. Plz consider adding @ and # lookup like @twitter app. Thx! http://t.co/5uHsTEPz
CCGDYhTdWM,Grace Thompson,xJwtjkz4jy,Mysterious Adventure of the Ancient World,1931-03-29,#microsoft #SBS 2011 disabling third party software #updates via #gpo
yFQhd2EHHV,Frank Lewis,NXDqmw4eUh,Incredible Adventure in the Mountains,1996-04-24,One word - #wow. RT @jldavid iPhone 4S First Weekend Sales Top Four Million: http://t.co/Zx5Pw0GT (via @apple)
4U0GWC5gxd,Jacob Harris,jRiyyEzUKZ,Amazing Life in the Mountains,1954-11-22,Why are manhole covers round? #Google #autocomplete
JYKkkIwDfI,Mia Brown,c4MF9yJeKu,Amazing Life in the Mountains,1975-07-03,#Twitter &gt; #Facebook
EWZ24oSRk0,Isabella Williams,tCjfMijzLO,Mysterious Secret Beyond the Stars,1931-03-17,@Motorola is the Best Android-powered company that is going against @Apple.
CDhlrXMEJn,Lucas Hall,DEux1C7kFO,Mysterious Story of the Ancient World,2008-06-26,#Google (and #Twitter ) get ready for the debut of #IceCreamSandwich http://t.co/T36KZ6gf
Mc6vC87tiE,Ethan Brown,VEiHIeEg3J,Magical Journey of the Ancient World,1928-05-03,buenas noches  #Twitter W:
2YtsxcrSw8,Jack Clark,ZhWAQxa2XN,Magical Story in the Future,1901-04-04,@apple Iphone's & Ipad's beautiful technology but alltogether mainly a marketing platform. It's obscure is'nt it? Apple lost it's touch.
gDSpfeE2vA,Emma Lee,KfRX8pXlmX,Mysterious Life in the Future,1921-02-22,"@Apple Would much rather get outta this having a ( see pic ) and have fun with this "" Have your friends choose music"" http://t.co/7IiHbr4J"
uaTz3Gkrja,Ethan Taylor,5Rda65md6v,Magical Journey in the Future,1923-10-03,@Ayy_Queen #google it lol espn too
UWjp2JBIfh,Noah Johnson,om9og7Hwhf,Mysterious Adventure Beyond the Stars,1924-05-13,A Child’s-Eye View Of #Microsoft’s #Kinect For #Kids http://t.co/mnamu0xF
Ort3sL304a,Jacob Brown,XjyX8z0OmV,Fantastic Life in the Mountains,1915-06-12,#GoodNightPeople Hasta Mñn #Twitter :B
dXrQb39HVu,David Walker,QeasNkrife,Mysterious Journey in the Mountains,1995-03-23,"Apples to oranges maybe, but #Twitter is way more engaging than #FB. Content vs. Stalkerismo"
AF0KfO23XB,Ethan Williams,Is3WNhrUr9,Mysterious Life of the Ancient World,1981-03-26,FreeSoftwareFoundation publicly warns of danger of implementing #Microsoft #Restrictedboot w/o #UEFI http://t.co/NASQbmaT #anonymous #USDOR
M6XThYyGJ1,Aiden Hernandez,IPHn5wiYTm,Mysterious Journey in the Future,1987-09-03,Search Governance in #SharePoint 2010 http://t.co/xtqv4DW5 #microsoft
TO4akhYDzC,Mason Rodriguez,b8u3D3oCTp,Fantastic Story in the Future,1986-01-09,#Google Google’s Infinite Bookcase: An Abstract Browser For Limitless Libraries http://t.co/MyLzFMRq
2yaT8ChFeV,Matthew Gonzalez,FSLI9jpzdg,Mysterious Life in the Future,1987-01-12,#microsoft ‘People-Centric’ Windows Phone 7.5 Update Released http://t.co/oImNAkVf
Bq3aLcES56,Noah Clark,ZBfJnfl77J,Incredible Story Under the Sea,2014-06-10,"TypeBuilder be gone, Roslyn CTP is here! Creating types without TypeBuilder! http://t.co/cilZFP9B #Roslyn #Microsoft"
PkMv3EzOGm,Daniel Jackson,3ehXcxJV10,Fantastic Secret Under the Sea,2014-08-28,New Galaxy Nexus: Video looks awesome! #nexus #samsung #google #android bit.ly/nEJbyE
5TEmyks6Jn,Lucas Davis,Y59ISCtWDG,Magical Story in the Future,1904-06-30,#twitter off
QJ3HzH3ZVc,Carol Smith,F5PiphhQsO,Amazing Secret in the Mountains,1938-04-22,サムスン、Googleと共同でGoogleリファレンス機「Galaxy Nexus」を正式発表、11月に世界各地で発売　http://t.co/zwSUFuez #androidjp #samsung #google #galaxynexus
rIbUrxgDDV,Evelyn Robinson,atWQGcSvcb,Amazing Story Beyond the Stars,1907-02-13,IHS: iPhone 4S shows key design and component changes. http://t.co/Y3Mali6y  @apple #apple #iphome4S #ios5
l2cODyLNev,Jack Thompson,RwAiMTkqci,Amazing Adventure Beyond the Stars,1963-01-21,Recent study of #Google CTR reveals that top three positions #in #GoogleSearch receive 35% of traffic. @Econsultancy http://t.co/Z2bh6oH1
8d5I7L6RW7,Logan Harris,HUchQYlYNt,Incredible Secret in the Future,2019-05-08,@jpobrien11 or windows bridge for windows phones and don't try and pretend apple didn't steal the notification bar from #google #droidtweets
5KZmAbPfcw,Matthew Garcia,YWXEhus6De,Magical Story in the Mountains,1991-07-01,#Microsoft lanza sitio oficial de #Skype http://t.co/FZeM9Na4
QY6boJ7AWw,Daniel Davis,4GSrdhyo3Y,Magical Story in the Mountains,1925-02-07,should be studying/ doing work but no I'm hold with @apple HURRY THE FUCK UP! #nopatience
nJp4kkgiOS,Evelyn Lopez,Y0hq82FJTt,Amazing Life Under the Sea,1914-01-10,@LuCkY_2_HaVe #Twitter
RCY5LvCmEP,Amelia Moore,sepVViBoFN,Magical Life of the Ancient World,1939-03-09,@cpmorris congrats on joining #twitter
5JyCNa0M53,Carol Williams,D1to6tsLoR,Fantastic Journey of the Ancient World,2005-04-22,Damn tired! .. Need some rest! Night #twitter
JpT7H2QeqG,Mason White,bnw7MSlvH2,Mysterious Story Beyond the Stars,1988-10-19,Good Morning #Twitter! Have a nice day. :}
AgkDtjfBdj,Charlotte Hall,sPqNbF3MbP,Mysterious Journey Beyond the Stars,2011-03-30,Quem não tem um #TWITTER que atire a primeira pedra!
JzvEGvHUfa,Logan Jackson,XeOuAPzGCX,Magical Life in the Future,2004-07-10,JOIN OUR #TT ON #TWITTER FOLLOW @ThisIsYungFRESH & @macDej #TT #RatchetSymptoms
ssSpG7bXJJ,Alice Anderson,Q52wYYEBnA,Amazing Secret Under the Sea,1954-08-11,Goodnight #Twitter :)
ihZrBweTEU,Ava Rodriguez,QM8M8qNovq,Mysterious Story of the Ancient World,1980-03-07,Here's what we know about the #GalaxyNexus http://t.co/7bYXbQVY #google #android
cAV7Mssdeh,Alice Johnson,1zqI5sUAps,Mysterious Journey in the Future,1961-04-30,ASSISTINDO O FILME CHAPA!! PIRATAS DA INFORMÁTICA  ESSE FILME E FODA VIVA @APPLE
ujpI1lwhPe,Sophia Taylor,ZDbOA6KjVU,Magical Secret in the Future,1943-05-25,RT @esmandau: BREAKING NEWS: Samsung Filtra Accidentalmente la foto del Galaxy Nexus http://t.co/vEgkjIfQ #Android #GalaxyNexus #Google
udMDIhPI96,Noah Thomas,rkdYeEUMsQ,Magical Life Beyond the Stars,1968-04-06,@BikerVox @mariomussolini @ios_notch @apple xD thats why i have a back up PC… just incase *hides gun*
FttYTiUMoJ,Mason Davis,Q6rAC4zhdn,Amazing Secret in the Mountains,1956-08-01,"@BrianCrockerJr yeah, it shows. glad you have #twitter :)"
K3VeFXoe7i,Ethan Anderson,U8PKE5jVoD,Mysterious Journey in the Mountains,1922-07-15,#Microsoft To Launch Its Own Version Of #Facebook Timeline Like Web Service Called Project #Greenwich  http://t.co/MmS14pDW
1foT7y4Dt4,Abigail Wilson,ydkp8apvPy,Fantastic Life of the Ancient World,1931-11-16,[iPad] iPad 1. Generation generalüberholt ab 389 € @Apple http://t.co/tOv1xKQ8
TGxL33UzkW,Evelyn Taylor,OjxQYfxgEF,Amazing Story of the Ancient World,1983-11-25,*sigh* @apple store seems stumped what to do about my catastrophically bad battery life after upgrading to #ios5
IvXpW5xa6P,Jacob Hall,uKO0ZcR1IE,Fantastic Life Under the Sea,1974-04-23,"Join Brainware in ORLANDO 11/2-discuss financial best practices, automation tech w/speakers from #disney and #microsoft http://t.co/gLYzOXMc"
PG8k5X1fca,Grace Perez,fmHUuNbTbK,Incredible Life Beyond the Stars,1905-03-15,I'm thinking about Google http://t.co/ACjRL4FO @GetGlue #Google
V93BTNmYH1,Logan Walker,qVxtZDPwqb,Fantastic Journey in the Future,1919-07-24,Check this video out -- Steve Ballmer: We were lucky not to buy Yahoo! ALALUYA http://t.co/V9rmRAUh #microsoft #yahoo #SteveBallmer
cOru0ywEqX,Evelyn Rodriguez,IgT00xwFx7,Mysterious Adventure of the Ancient World,1963-04-29,Meu Bom Jesus que velocidade de captura é essa ? #icecreamsandwich #galaxynexus #google #samsung
wKhoHPWzqj,Charlotte Harris,Wbep5U65U4,Fantastic Story in the Future,2009-07-03,"Welp. RT @Tree @Apple you didn't fall too far from me, huh? RT @NikkiNotNiki Nia Long's mom is gorgeous.."
dacfWrBeE9,Alice Lopez,E8B46hchdS,Magical Life of the Ancient World,1920-08-23,Una porquería las páginas web hechas en .asp y pensar que muchas paginas del gobierno trabajan sobre esta tecnologia de #Microsoft
4wDyvrVdYI,Aiden Walker,x8jZirDCPX,Magical Life in the Future,1910-09-11,http://t.co/Izh7KaiU #google #nexus #prime &lt;3 #android
q1BYqMuSQK,Isabella Robinson,XWMMxin9zM,Incredible Life Beyond the Stars,1992-09-28,#Microsoft's Steve Ballmer attacks #Android phones (Telegraph) - http://t.co/9wbIy1Er
jp9lYUFVrk,Emma Taylor,znjYfTcNy3,Fantastic Adventure Beyond the Stars,1941-02-15,#twitter why must you be so difficult?
aBgyCnFWq2,Henry Moore,hAYY9YW4Cq,Amazing Adventure in the Future,2001-03-28,@LennyDubz you do know that @apple is not the company. and why u blasting me on #twitter???
3YfiRw7aUD,Eve Harris,miEiKmbB1s,Mysterious Adventure in the Mountains,1946-12-09,"يبدو ان طفرة الاجهزة الالكترونية القادمة ستكون بقيادة موتورولا ،، لاسيم بعد استحواذ قوقل عليها. 

#google #motorola #moto"
4VB710P0J1,Carol Davis,aFdgURdmis,Incredible Life in the Future,1902-07-31,I can't wait to get the new #Galaxy #Nexus with #IceCreamSandwich... best yet it supports my #Google Wallet http://t.co/bqMuHxkK via @cnet
n1b3L62CQd,Jacob Gonzalez,RsTYhS8M4H,Magical Secret in the Mountains,2020-12-23,I just installed Twidroyd for #Twitter on my #Android Phone - It's #Free and you can mute users :) http://t.co/kIHs1HRm
C9i3nrNpf9,Carol White,CgqxYQxZqi,Mysterious Story Under the Sea,1935-05-31,A Child’s-Eye View Of #Microsoft’s #Kinect For #Kids http://t.co/mnamu0xF
w5ED1113G9,Logan Miller,MvdhzWurrd,Magical Secret Under the Sea,1997-08-20,"Ballmer: ""Necesitas ser un científico para manejar Android"" http://t.co/7iEeAtNR #Microsoft #Steve_Ballmer #SteveBallmer #Windows_Phone"
StzSnPzNGp,Aiden Harris,hl8RxZpGXn,Fantastic Secret Under the Sea,1997-06-02,now watching live stream of  #Google new mobile #Nexus
