Blog_ID,Author,Author_ID,Title,Publication_Date,Blog Text
HGHGw1WmVo,Ava Thompson,NECNwh91sM,Fantastic Secret Beyond the Stars,1974-05-21,De verdd qe si me he sentidoo rara estar un Dia sin mucho #twitter :B
XOMwJyM7sz,Aiden Miller,jRtduCtlz8,Fantastic Secret in the Mountains,2018-05-27,why the fuck dose my phone decide its just ganna freeze every time i try to update it so fucking sick of @apple
B8sXPMapPj,Ava Perez,luyuewDvEe,Mysterious Life Under the Sea,1981-05-07,Steve Ballmer slams Android #microsoft #steveballmer http://t.co/fD1m8vN1
ojOAwZAgEF,Liam Hernandez,lUu7binYrn,Mysterious Adventure Under the Sea,1984-01-06,I HATE #TWITTER
lfBRYUTzlj,Lucas Perez,uodgm8tUjK,Incredible Life of the Ancient World,1958-04-08,#twitter تويتر حيث تنتقل الثرثرة من اللسان الى الاصابع
R5YQ9zGRah,Jacob Martin,CuZjooSb4t,Mysterious Life in the Future,1957-08-10,On Google+ then go here http://t.co/oTBwkxo9 #GPlus #Googleplus #Google #teamfollowback #socialnetwork
9M0mSIYlIj,Matthew Brown,hcIbqI5J5P,Amazing Life in the Mountains,1914-10-28,"#microsoft Steve Ballmer, CEO da Microsoft, critica usabilidade do Android http://t.co/OzC9ncs1 #windows #tecnologia"
M5WRZZtpzy,Matthew White,54WNaf4Ukf,Incredible Secret in the Mountains,1946-05-15,"RT @dulmandakh: #Google буузаа түүхийрүүлчихсэн, аврах аргагүй учир удахгүй хаана. би тэрнээс нь өмнө хаачихлаа."
y06Vf0Uhvf,Noah Hall,eBolsigQfH,Fantastic Adventure in the Future,1900-02-24,@tomcastiglia and @sharepointony now presenting on #SharePoint upgrade planning at our #SharePoint ECM Summit at the #Microsoft Tech Center
0rDtb6b1hI,Eve Anderson,U2VtGSXbd8,Amazing Journey in the Mountains,1912-12-29,"Cachando que @markrussinovich, aparte de ser un maestro #geek, también escribe novelas http://t.co/OcTuUYlo #microsoft"
0mC8bApkTQ,Bob Lopez,F1vAKvUvO9,Fantastic Secret in the Mountains,1939-11-13,@Ladycamia @JewelSantini check out that link sis - some good stuff on #mindfulness #medidtation techniques on #google - jewels swears by it!
2hbKr16CVX,Amelia Martinez,HMxYfQ0f6O,Mysterious Journey in the Mountains,1959-01-25,Ice Cream Sandwich is out!   http://t.co/YyceZpDy #android #ios #ics #google
3epxN6Lz8T,Daniel Hernandez,q3ok0RAWQE,Incredible Secret Beyond the Stars,2009-02-01,Whats a good #twitter ap for #iOS that links to #FB accounts to post links? #help
1CRD13ge9o,Daniel Jones,yiuZQnPEOT,Mysterious Life Beyond the Stars,1925-06-04,@JonathanGodin Je crois que #Twitter devra ajuster ces petit problèmes désagréable !
hK18jfEYEj,Mia Martin,EYqVxKAjHE,Amazing Life in the Future,1978-08-20,#Android #Google Android 4.0 Ice Cream Sandwich Has Hardware Acceleration http://t.co/ijWr1mUJ #DhilipSiva
9nF99g1nTD,Emma Thomas,jWtKV6AtBZ,Amazing Journey of the Ancient World,1984-03-10,Belle le magliette che diamo a #SMAU in #Microsoft http://t.co/mU5iHlQi
q1ipo4K00c,Ethan Lopez,UaDn3vCPPD,Mysterious Secret of the Ancient World,2004-08-13,Vincent Mugambi #Microsoft takes us through #WP app
RkcWaHfA12,Frank Brown,mqihYnQXnH,Amazing Journey of the Ancient World,1967-10-12,#microsoft #SBS 2011 disabling third party software #updates via #gpo
mEjOT7NMFL,Henry Lewis,PhX2JzgAoI,Mysterious Life of the Ancient World,1966-09-01,@xwordy iCloud was new; I didn't need weather or stocks but they were there pre #ios5 so I'm not hopeful that this will help @apple
xm9FJuXIgp,Isabella White,C3DSmR3mDQ,Magical Life in the Mountains,1913-12-01,"IOS5 has one problem, when i save someone in my contacts they don't show his nam becuz of the region/ +965 @apple #apple"
9jbkLKjTF7,Ethan Lopez,LVkOzORmZ7,Magical Story Under the Sea,2005-06-07,"ну собственно, товарищи, фотки интерфейса #Google #GalaxyNexus кто еще не видел: http://t.co/NS2jNRL7"
hishbDIs6a,Ivy Harris,77OBbZ2ikd,Incredible Journey in the Mountains,1962-05-19,Lucha de Titanes: Las tres mejores alternativas a #Google Earth http://t.co/5X5pVRHr #Linux via @gabriel_j_gomez:
f495gvigic,Lucas Lewis,0hPOA8MgPA,Incredible Secret Under the Sea,1922-06-02,"RT @ralphbin: #Microsoft Research shows #Holodesk - looks like science fiction, but is science fact http://t.co/w5OCrbpm  Cool but  no sound"
BIHctbezD6,Emma Williams,fjFFzlBofy,Mysterious Story in the Mountains,1915-03-11,Online Music Industry is witnessing the astounding revolution. Can #Google manage to seal the supreme console? http://t.co/iUi7JtCM
rVpwYc7ADG,Evelyn Moore,IrcHi5RjxF,Magical Journey in the Future,1939-03-09,@macworld_brasil vcs conseguiram fazer funcionar o find my Mac? O meu sempre pede para reportar o erro a @Apple !
41UatFljmI,Ivy Moore,tFooK1O6fM,Mysterious Journey in the Mountains,1954-03-09,New iOS 5 update is THE BEST. iloveyou @apple
hUSmLbJc4T,Charlotte Brown,VtXDAlcifg,Amazing Secret in the Mountains,2002-06-09,Twitter's Thinking About Paying People to Tweet - Technology - http://t.co/zA9h5o5U #PayMe #Twitter
MkDAlbBCf6,Carol Jackson,n8OWTzXhTd,Mysterious Adventure Beyond the Stars,1909-01-07,Le panorama est très sympa et peut être coupé à tout moment #google #nexusprime
WgjIjt4Hxb,Matthew Thompson,2ykN1bPDA8,Incredible Journey in the Future,1957-05-24,#TeamFollowBack #TFB #MustFollow #MF #FollowNow #FN #FollowFriday #FF #IFB #Twitter #Follow @Only1DeejayER &lt;&lt; oooh DAMN nice pic!!! #Ladies
Ch7hgJl7Lm,Jack Harris,9SC10yFgYY,Amazing Secret Beyond the Stars,1994-10-13,"Dear @apple, as a hoh/deaf user, can you please add options for stronger and longer vibrate for #iphone4s ? Thank you! #hoh #deaf #ally"
Tg6zHMUbx2,Carol Perez,6SHvB1OVYA,Amazing Story in the Mountains,1986-11-30,The takeaway from the @Apple earnings call?  Even Apple needs a new iPhone release every 12 months to stay competitive. cc: @hblodget
bmfy7l1wWd,Jacob Walker,W8zlgUMX8x,Fantastic Secret Beyond the Stars,1944-09-06,Internet Explorer 9 is the biggest pile of shit ever seriously #Microsoft #IE9
C4b97hWILa,Eve Davis,xJrTnIr4xZ,Magical Adventure in the Future,1901-05-06,@pani_mondragon =O como dices eso =( pss no tengo servicios en la bb solamente #twitter
dK66BfEfaW,Aiden Miller,6NAVzWqr33,Amazing Secret in the Mountains,2012-01-08,"@apple: Multiple times siri is ""having trouble connecting to the network.""  Siri needs servers (and some exercise!)"
wHpBj7Gx0l,Emma Robinson,IdczFno1dZ,Amazing Adventure in the Future,1945-02-21,New #snom Webinar Nov. 2: Accelerate #Microsoft #Lync Deployments with snom #UC. Register here http://t.co/B1pr1kIX #VARs #phones
PNydmpNywi,Matthew Martinez,q9dV8llhry,Magical Life Under the Sea,1972-12-04,@garbage Welcome to #Twitter!
iK2OamM2Rf,Lucas Perez,XCbZ2fHXtc,Magical Journey Beyond the Stars,2001-10-13,You need to ask #Siri her favorite color and the average speed of an unladen swallow. Seems Someone @apple is a Monty python fan
RndDXfaYnh,Jacob Gonzalez,0rQ2quSUCZ,Mysterious Adventure of the Ancient World,2022-05-30,"Now, really #google how hypocritical is this? http://t.co/6nHuYFeh #analytics"
GqSazRfWf8,Liam Thomas,toj4vvUW46,Magical Journey in the Mountains,1940-02-29,#Android #Google Samsung Galaxy Nexus Coming Soon To Three UK http://t.co/FQbfdiYE #DhilipSiva
LALhP5SF0L,Liam Martinez,9hiaiKFs3P,Incredible Journey in the Future,1971-12-03,"RT @nagoul1: Can anyone please explain to us why the #Retweet ""issue"" is happening to many, but not to others? #twitter #tweeting #tweeps"
9YZOrtuCvt,Emma Hernandez,M3FGvkoZt3,Magical Adventure of the Ancient World,1999-06-07,"is mulling #google+ but hmmm, just aint shore bout nuther social media profile."
jrTP1OOORc,Jacob Garcia,VHVseDqAhK,Mysterious Adventure in the Mountains,1999-09-14,BREKEND: #Microsoft en #Linux nu beiden in de aanbieding!  http://t.co/oyeqR80p
5OAZ7BtcER,Jacob Davis,5vOxuyK4lL,Fantastic Journey in the Mountains,1963-04-08,Dr. Ogalinski - El Proyecto #OmniTouch de #Microsoft: todo el mundo es un touchscreen http://t.co/qzt26Gj8
1sbjWlIg71,Amelia Moore,kTiy0rCHI4,Fantastic Story in the Mountains,1943-05-28,engineers #google Manny Marroquin #MannyMarroquin
MNIqfl4MfY,Alice Brown,AGGNA7iM6E,Fantastic Life in the Future,1904-05-07,@Le_M_Poireau Mais moi je voudrais pas que @apple donne mon fichier @LaLibreBe. Marre d'être spammée par les journaux désespérés.
vGlBM6aRsq,Aiden Lee,gBGGmalirs,Magical Journey in the Future,1968-09-03,Belle le magliette che diamo a #SMAU in #Microsoft http://t.co/mU5iHlQi
SIyUBexOad,Carol Lewis,qeWCTeMMYO,Mysterious Story Beyond the Stars,2012-02-18,"Los fabricantes de móviles y su integración con las redes sociales: Sony Ericson apunta a #Facebook, Apple a #Twitter y Samsung a #Google+"
gtDvJBNDQx,Jacob Jackson,O8aVRamfPZ,Fantastic Life Under the Sea,1908-08-27,@apple you can suck it you and your fucking iPhones better be glad it's all I like cause the service Is fucking terrible
MvPsr9tAaT,Frank Davis,c34TgC9MvA,Mysterious Secret in the Future,1957-10-20,"Forget Siri, there is still no beating speech commands on @windowsphone: http://t.co/19GAjSGi #wp7 #mango #tellme #microsoft #siri"
2RcfZ0e107,Mia White,k3rzRpUCae,Amazing Story of the Ancient World,1926-09-02,#twitter and fb# off
OL455hJQ3E,Isabella Jones,BMXVPKQPAi,Amazing Story Under the Sea,1930-03-25,"The new Nexus looks good! UI feel a bit confusing but I guess Android users are ok with that! Now, try it :) #Google #android #nexusprime"
ORTu4JHXWp,Jack Martin,g6zbFiKmVo,Fantastic Adventure in the Future,2010-05-23,Got to do it!RT @ElderMLTillerJr: I am cracking up at @BishopWSThomas advertising for #Twitter LOL
Sw6GdUFCos,Mason Jackson,O4W07egReP,Mysterious Life Beyond the Stars,1945-12-06,"Ah, Steve Ballmer..! Altijd goed voor een fijn lachmomentje: http://t.co/zD14Sy6e #microsoft #iphone #mango #android #ios #apple #google"
WYc5V24nV4,Noah Walker,sGqAT4csMh,Incredible Secret of the Ancient World,1970-08-02,Wyszukuj jak Anja Rubik (albo Colin Farrell) z #Microsoft http://t.co/1KHSfK8k
z0Qk2y4nio,Noah Thompson,TvIdXFp02D,Mysterious Adventure Beyond the Stars,2004-05-12,Google Earth Helps Locate Salmonella Hotspots http://t.co/mcz9RSDf #google
1AX8pmk1Fw,Ava Jones,yS3YmquoMH,Fantastic Secret Beyond the Stars,2020-04-29,I need to get off #twitter
Y7Vsx13yZo,David Garcia,v5r9uDpRWk,Mysterious Journey in the Future,1956-04-13,Thanks @apple my girlfriend likes #siri more than me now.
wdexZy2CcH,Grace Martinez,OYRgwNx5ap,Incredible Life Beyond the Stars,1944-08-05,WOW the new #Google #Nexus is just beautiful. totally gonna boost google's market share in the smart phone market.
1bdAQwArpL,Mia Jones,irMPwQY3hC,Magical Story Beyond the Stars,2014-03-01,"Ballmer Feels Lucky Microsoft Didn't Buy Yahoo in 2008, http://t.co/mPZoilRs #microsoft"
2BjY1Oa7rE,Ava Johnson,8g9XcIhUGD,Magical Life in the Mountains,1950-05-26,#twitter goin hammer
yhZHrrseU4,Matthew Moore,t1SUy3fRKI,Amazing Adventure Under the Sea,1998-01-14,#Twitter Im coming home Im coming home tell the world that Im coming home lls
wNBTfi8VXH,David Harris,S4F2v3gHVa,Magical Life Beyond the Stars,1938-03-03,O poder de #pensardiferente: a mágica de #SteveJobs foi transformar egomania e obsessão em trunfos http://t.co/qkUoeEzv @apple @ipad @ipod
m4dWGqogiC,Mia White,dZpR19n3cr,Amazing Life Under the Sea,1950-12-31,RT @calvinnieh: Learn how to keep Microsoft #Exchange costs low today at 11am Pacific.  Win with #Microsoft and #NetApp Webcast @ http:/ ...
a7o7ZgSyPq,Amelia Gonzalez,nIOyosN32B,Fantastic Journey in the Mountains,1942-02-07,"#google #yahoo #bing Ballmer on Bing, Xbox, Apple...oh, and Yahoo, too http://t.co/CfHu4jBP #seo #serps"
eZggbFA5ZF,Amelia Thomas,o5FKTmwSQx,Mysterious Story in the Mountains,1969-04-27,"Michael Jackson Quiñonez, jugador de la Selección que está en los Panamericanos es ""TT"" tendencia mundial en #Twitter."
iJuN0eIcpX,Noah Brown,D6lDOBzKNS,Amazing Secret in the Mountains,1913-02-24,So @apple changed the look of their on/off toggle. I wonder how long it will take for all the hip web apps to follow...
ttSr7WlmxT,Daniel Thomas,jBews6g46M,Amazing Adventure of the Ancient World,1989-05-14,"…and only the first 23 images in my Photo Roll made it over? Seriously, @apple, how did you fuck this up so much?"
66As4qFQx3,Carol Davis,1Ci4PRs2qf,Fantastic Life in the Mountains,1955-10-14,"This is better than *every* magazine having their own #app! @EatMagazine @Apple supports magazines. #Ipad upgrade adds ""Newsstand"" #app"
PDcI30FtHs,Carol Walker,Okgx6c6g8L,Mysterious Story in the Mountains,2018-03-21,^___^ que amable es la gente de @apple
V0k7bpsfYX,Ava Wilson,wskeJBxs0L,Amazing Life Beyond the Stars,2021-02-28,"Microsoft opens the spigot, Windows Phone Mango available to all #microsoft #windowsphone: Microsoft has said th... http://t.co/uEpATRzx"
3NSXxdzxij,Mason Brown,A0YyjwsJ7D,Incredible Adventure in the Future,1988-02-11,RT @anfisabreus Как настроить кросспостинг комментариев с блога на Твиттер http://t.co/6DLxWIlU #twitter
M5K2CntYNn,Evelyn Moore,hG1Oxgqhpq,Fantastic Adventure in the Future,2009-07-20,RT @Jackiebaaby_: #'s are  #for #twitter #NOT #facebook. Duuuuhhh
1yYpYzB3md,Eve Martin,ww0thkE62c,Magical Journey in the Mountains,2002-05-04,I made a reservation and yet I still have to wait in line. Humpt! Oh @apple (@ Apple Store w/ 2 others) http://t.co/JZmVBdNm
lYQfIP8EzM,Emma Anderson,MdoWK5UPGK,Fantastic Life Beyond the Stars,1952-03-21,el #twitter x cel no s!rve e$ un ascΘ(...)
6frQgW3zA6,Henry Robinson,rh8rE1qA6b,Amazing Life in the Future,1910-01-28,E o meu #Primo @eduuaardo_ que nunca mais apareceu pelo #Twitter?  Saudade de você primãao ♥
OQQlSN0642,Abigail Johnson,3xZh5hZ7wf,Amazing Secret Under the Sea,2003-09-11,Life was much easier when @apple and @BlackBerry were just fruits!
dUzNcrhtCS,Matthew Lewis,IPVPYyMQef,Amazing Story in the Mountains,1957-01-04,@ferchowii @Adr_Mart_Com @Apple no tengo
rcQBKSq2So,Isabella Hall,ranrfL8JeD,Amazing Life Under the Sea,1967-12-21,"RT @ihaberplus: Dijitalde 4 ödül Türkiye'nin!                                   #microsoft #bug #yahoo 
http://t.co/xwm15RVQ"
LMkp2TzTUn,Henry Davis,QIIr8pMdmq,Mysterious Adventure Under the Sea,1960-12-28,@obsexxed69 got one of the dopest blogs on #Twitter and #Tumblr...#RealTalk
dXUP5GgpJd,Grace Gonzalez,RMocCUGPoq,Fantastic Journey of the Ancient World,2000-09-15,De verdd qe si me he sentidoo rara estar un Dia sin mucho #twitter :B
qEahAeHSKn,Olivia Moore,d87RUzCF6X,Magical Life Under the Sea,1996-11-16,One thing I want from #ios is searching in the add bar similar to what Firefox or droid phones do. But thnx for a talking Google @apple ...
Vezyvabecb,Eve Lopez,hkYw5w6zKA,Fantastic Journey of the Ancient World,2001-01-12,For all the bookworms out there! http://t.co/Mx2bMy3o #Google’s Infinite Bookcase: An Abstract Browser For Limitless Libraries #technews
W8tb5nezPP,Henry Davis,LLIg8ZD8pa,Incredible Story Beyond the Stars,1946-07-15,#Microsoft's Kinect brings 'playful learning' to the Xbox 360 http://t.co/1KAi853k
k5VDOrUMvb,Ethan Robinson,osIbVIoRFy,Magical Life in the Mountains,1930-03-16,#twitter and #Facebook gone get sumbody beat up mane everybody b so reckless
cdkIKtP4A9,Frank Hernandez,FeXqiict5T,Amazing Life in the Mountains,1911-12-21,"Steve Ballmer: ""Android är komplicerat. WP7 är lätt"" http://t.co/6Kn1Ocgg #ios #microsoft #wp7"
1ZZR5SR6DF,Frank Smith,nyBWtCU9cK,Incredible Life of the Ancient World,1923-07-09,RT @packard_bell: #Microsoft presenta un teclado #touch sobre cualquier superficie  http://t.co/mU1FdIhF
dfeOy0EKUH,Grace Davis,FwQkWFU4Dd,Amazing Adventure in the Future,1926-05-28,@apple not happy with Apple today. I did the suggested software update and now nothing works!!!
2dsP87p3jZ,Matthew Jackson,LlftEqocjh,Magical Life Under the Sea,1985-12-05,God morgon #Sverige och #Twitter !
3DfihuSuUp,Noah Smith,LkQo7EewTn,Fantastic Journey Under the Sea,1960-05-22,"My DM's Come in So Fucking Late, Damn #Twitter"
MFhdTbmzdI,Liam Rodriguez,BIkyU30vZq,Fantastic Story in the Future,1924-04-11,Goodnight #twitter 
SeHSL4Lrze,Jack Jones,viGSrtYYAP,Fantastic Adventure Beyond the Stars,1913-03-28,The more i use Office 2010 the more i fall in love it with. #honest #genius #microsoft
XW8IsT4FMr,Isabella Robinson,AHUtcBt8Pf,Magical Adventure Under the Sea,1908-08-04,RT @meko2301: #Google #Android #ICS #IceCreamSandwich
gBTA3Z1Vby,Lucas Harris,keeFrYNfZp,Incredible Adventure in the Mountains,1905-06-15,#SEO Tip:Examine #Google #Analytics reports frequently.Check the conversion and bounce rate+analyze traffic sources
u8DYKSQfqQ,Lucas Taylor,GRIU0GXFVN,Magical Secret Beyond the Stars,1956-11-11,#Kinect -projector makes all surfaces touchscreen #ar #touch #microsoft #xbox360 #gaming #games  http://t.co/67CMvCki
KZjTv6fYGv,Logan Davis,sshj23f6V3,Magical Adventure in the Mountains,2023-06-24,"Hört einen #Vortrag von Leslie Lampert, einem #Microsoft Guru"
c1pzggf9dt,Alice Martinez,bGKKPZOUoJ,Incredible Adventure Beyond the Stars,1912-03-07,#twitter #detik Ketua Dewan Adat Papua Jadi Tersangka Kasus Makar http://t.co/Jzqi1JUI
VowOIjYiWN,Amelia Williams,m5hiVyJskl,Incredible Journey Under the Sea,2018-05-16,Nadie es tan lind@ como en la foto del #twitter y tampoco tan feo como en la foto de la cedula...
cokyvkNOIP,Emma Robinson,w4Q19I7NuJ,Mysterious Adventure in the Mountains,1915-08-12,“@GeeCloud: Congratulations to Softline Pastel (@SageGroupZA) for winning #ISV of the Year at #Microsoft #partnersummit” @SoftlinePastel
elmkFYJwyf,Lucas Clark,1Ve9trRVcX,Incredible Life Beyond the Stars,1966-05-04,Why didn't @apple provide 5GB per device for cloud backup?  Why just 5GB per account?  Silly.
p0FYwwDpPl,Frank Jones,ZNYyTZ9R1M,Magical Adventure in the Mountains,1938-01-22,Me encanta vacilar y ver tantas cosas en el #Twitter cada vez estoy mas #enamorado de este medio de comunicacion es #unico
AFnQlgEN9M,Abigail Thomas,MIGYMEA71X,Amazing Adventure in the Mountains,1917-11-16,"Camarada @michelenlared, mándale a @mvdan los enlaces de los dólares de #Google que financian a la #FSF porque no quiere creerte... xD"
ec0N4FovFI,Jacob Anderson,oUC5yhczeQ,Mysterious Story Under the Sea,1919-01-16,#Twitter TEAMO♥ Chao!
gEw7yk95vo,Aiden Harris,PCzDnFfP66,Incredible Story in the Future,1960-12-28,"@Apple main office is #nowplaying  
A milli - Lil Wayne."
ckpBT2vF71,David Anderson,FT9FE2Stmj,Fantastic Journey in the Future,1905-05-09,#Twitter should have Emoticons
DWcRRbgUqM,Sophia Jackson,OxbSkqW8Bj,Fantastic Life in the Mountains,1900-11-13,"Is #Google Down? http://t.co/wFrzKYsN via @Ejunkie Good for #Bing, #Microsoft ’s investments paying off"
ULHXUkBPxo,Jack Lopez,u75IfY7hhp,Magical Secret in the Future,1958-05-09,#Occupy #Twitter...Let&#39;s make Twitter a Social Media not a just a Bulletin Board. Engage! Interact! Socialize!
5eXdEPS1zk,Ivy Jackson,KGNv1O8Cr9,Incredible Story Under the Sea,2023-04-25,@NaniRicciHitch Mais oooh! Je #Joke comme on dit sur #twitter -___-' On papote demain! :) Bises
8O51jdzbng,Emma Lopez,Wi9tFNHdMX,Fantastic Life Beyond the Stars,1953-01-01,#Microsoft's #Ballmer touts #Bing; analysts still wary about its future - http://t.co/jvQWzHkd &lt;- siehe mein Blog dazu: http://t.co/pLwVE1Iy
KSema1XvNJ,Charlotte Anderson,iPBFv3pepX,Incredible Secret of the Ancient World,2007-11-20,Tomorrow at #SAPTechEd Bangalore: #SAP & #Microsoft Building Apps for Both Worlds w #DuetEnterprise & #SAPGateway. http://t.co/te4NQmxN
ki7wQeWKEp,Aiden Moore,WTwsfnUHbG,Mysterious Story Beyond the Stars,2009-06-08,"Bij #Microsoft zijn ze echt niet goed snik, ik was blij dat mijn mobiel gejat werd omdat er windows op zat..  #jaloezie http://t.co/fd0THHCv"
0kLWpUkTZ9,Mia Thomas,S3LF7xENFZ,Amazing Adventure in the Mountains,1939-01-19,@PrJusto Don't question the @Apple they will remember your dissent!
ejBc21uaU7,Grace Jones,pdvHsYwY8s,Amazing Life in the Mountains,2014-08-29,@YoungBasedSonic #Google
nDRqSIrOSD,Evelyn Perez,C9TC2NTKCf,Magical Journey Beyond the Stars,2009-03-31,@chefreggie06 @rolandsmartin @Apple get ready Tampa Bay the Martin's are coming to town! Bring it on Buccaneers!
Ps2QOc158P,Amelia Moore,vwkF4m94AZ,Amazing Adventure in the Future,1904-02-16,"I agree with @wellis68 that the ""Hangouts"" on #Google+ are friggin' awesome!”"
QdlRNPpZwL,Ethan Taylor,y4iNoseqbM,Incredible Secret Under the Sea,2002-12-04,#Twitter Buzz Builds for the #Occupy_Wall_Street Movement [CHARTS] http://t.co/gHCez2Yk
LCXo9yQX3E,Liam Williams,71CqsXHCeh,Incredible Adventure Beyond the Stars,1922-10-07,I hope @apple will release an app for Siri for us non-apple 4s users. #apple #iphone #siri
nIHkJmr7oq,Aiden Robinson,spJDI6KZr3,Fantastic Adventure Beyond the Stars,1942-06-17,"RT @MichaelKroker: Steve Ballmer: #Nokia to reveal multiple #Windows Phone devices next week, #Microsoft may make their own - http://t.c ..."
6PyCXxj1u6,Alice Moore,zLoOyDFZeG,Magical Journey in the Mountains,1934-05-03,#TWITTER OFF.
JbtsEukcsV,Ivy Clark,YyNKZklmWt,Incredible Journey in the Future,1924-11-17,@apple Cards app notifies me the card I sent has arrived at local post office and should be delivered today... Sunday. Truly is #magic.
ZAd7P3Udq1,Bob Jones,r1FHr1TAYR,Amazing Secret of the Ancient World,1931-07-16,"www.geoloco.tv - #Geoloco, future of tech, brands, ads in location revolution - 11-3 San Francisco - keynotes #Google, #Facebook, #Starbucks"
YwxyFY6yRS,Jack Jackson,XxxjXyA6Vl,Fantastic Secret Under the Sea,1916-05-24,#MichaelJakcsonQuiñonez wowo ya es un tema muy comentado en #twitter
MJjyH2ZyLp,Eve Smith,f5JumpPjDT,Incredible Adventure Under the Sea,1910-06-10,#Twitter (of)
zCrRSkA0Oh,Amelia Brown,JHJ7qZiR0v,Mysterious Journey Beyond the Stars,1984-04-26,#Google announces #NFC-based #Android Beam for sharing between phones http://t.co/zYKEr3ax via @engadget
CdSINgyOh7,Bob Walker,GLwJyCgByA,Mysterious Life Under the Sea,2008-03-04,#Teamfollowback -Microsoft expands Windows Phone Marketplace to India #microsoft #windowsphone #india
U41GNx53i6,Olivia Perez,UBmM1QHj83,Amazing Secret of the Ancient World,1975-03-14,"In terms of unified communications giants, really surprised to see how underrated #Microsoft is"
sAoqdAT4ki,Emma Martinez,pqlsxoYJwC,Amazing Story Beyond the Stars,1982-07-08,#google is my bff rite about now!
sGf4XRcQ9N,Abigail Robinson,m4YQRXMNub,Incredible Adventure in the Future,1934-10-01,#Google Sit and Go Center Method For Profitable Sit-N-Go’s on PokerStars: http://t.co/6PwI0rjZ -Co... http://t.co/JCqPi1hS #wikileaks
F72HMxQkXs,Logan Robinson,J2xWH4kYCw,Fantastic Adventure Beyond the Stars,1965-12-26,Pelado con la tecnologia iria a pegarle una piña a #BillGates. Odio a #Microsoft.
reSM2RgwJb,Liam White,jl7q2giqRq,Mysterious Secret Beyond the Stars,1954-05-06,Register now for your Galaxy Nexus :) http://t.co/37WkIoXC #Android #Google
zolMaI5VzL,Grace Taylor,eo3hptb8PP,Fantastic Journey in the Future,1970-10-13,che palle sto cacchio di #WP7 di merda con un #Whatsapp che funziona di cacca per colpa del sistema di #notifica! @apple send me an #iphone
9b8s17MlT5,David Anderson,qYpVMjIFP7,Mysterious Life of the Ancient World,2012-11-07,If @Mr_A_Johnson is up. #twitter is gona have some technical difficulties
ncNCtjiAFf,Lucas Robinson,c7BdNLCgRJ,Amazing Journey in the Future,1910-02-05,"RT @fredbenenson: Hey @twitter and @apple, this is pretty dumb. http://t.co/kubkPO0T"
WAF9w6sK9w,Amelia Thompson,nshEwCDypf,Fantastic Life of the Ancient World,1955-08-24,Flowers & Apples shower the Santa Monica @Apple store in honor of #SteveJobs http://t.co/xGf60gMs
wgxJwcNO2I,Amelia Jones,50cmczO45D,Fantastic Secret Under the Sea,1980-06-11,@apple http://t.co/awASwV5u
jYOSBwiouf,Aiden Thompson,1wJY0keghf,Amazing Life Beyond the Stars,1960-08-23,"I absolutely love my iPhone 4S. Thank you, Steve and @apple."
IzLXT4s9zZ,Frank Garcia,hgPSv6H8yM,Mysterious Life in the Mountains,1919-11-26,nothing like saying 'screw you' to a bad real estate company on 7 different social pages! #google #citysearch #yellowpages #yelp #yahoo ...
6bn5KWUZGT,Sophia Hall,3H1wzoxaZq,Incredible Secret in the Mountains,1910-07-03,"#10twitterpeopleiwouldliketomeet 
@coollike @TheGadgetShow  @thelittleappkid @Jon4Lakers @BenRubery @Apple @twitter @FXhomeHitFilm  (-2)"
AvYG6atnqW,Ethan Gonzalez,mvoEXzxZlq,Magical Life Under the Sea,1955-02-09,Data Usage: Nada mais de aplicativos para monitorar tráfego de Dados #icecreamsandwich #galaxynexus #google #samsung
hhyLMvu7u7,Liam Hall,wji9gD0bf1,Amazing Secret in the Future,1971-07-22,no es mucha  novedad que hotmail este down todos estos dias #Microsoft
oiGOBSLQNm,Carol Martinez,jGme6C8qYD,Amazing Secret Beyond the Stars,1907-05-18,#Microsoft tries to combine the #Xbox #WindowsPhone and #PC and all of them will share the same neat looking interface. http://t.co/J332zfpO
ArvnXFlTMA,Emma Garcia,je94kN5de6,Magical Life Beyond the Stars,1939-01-21,"Lmfao look at the argument I had with Siri !!
@ijustine @apple http://t.co/D4VjL7SI"
5h8Avyq22r,Emma Harris,dzUcwddPur,Mysterious Secret in the Future,1956-12-10,"ugh! @apple, you’re reservation page for the iPhone is NOT working."
FvmWaDEtWL,Isabella Hernandez,uGBPHCaUnK,Magical Secret in the Mountains,2011-09-29,"But @att is ""working"" with @apple to make their iPhone say 4G RT @JFSikora: @TCPJ_Mickey I'm so glad Apple is not slinging that crap."
67BZBCXL7x,Alice Taylor,oTQVjZAOIr,Fantastic Journey Under the Sea,2015-07-22,RT @NeowinFeed: Google shows off new Ice Cream Sandwich features #google #android http://t.co/LlJpGM2a #neowin
7UrdQRtmig,Ethan Walker,mMgyJAJJbd,Fantastic Story in the Mountains,1963-02-28,#Microsoft #Search Idea Could Let You Search Like Miley http://t.co/JoMucrMb
ISE5DEeZsq,Daniel Harris,jNjAFkCu9W,Amazing Life in the Future,1967-12-04,"#Siri on @Apple #iPhone4S can allow unauthorized access to texts and emails, even when the phone is locked!! http://t.co/0q5dLt22"
44bGC07ilX,Amelia Moore,dt1pWpRJG3,Mysterious Journey of the Ancient World,1994-12-17,Analistas preven un buen inicio de año fiscal para #Microsoft - ABC.es : http://t.co/f5StriT6
